{
  "schema_fingerprint": "0000000000000000000000000000000000000000000000000000000000000000",
  "git_commit": "deadbeef",
  "built_at": "2026-05-15T12:00:00Z",
  "verdict": "pass",
  "fail_on_drift": true,
  "trace_failed": false,
  "drift_failed": false,
  "exemption_failed": false,
  "attestation_failed": false,
  "unsuppressed_blocking": 0,
  "suppressed": 0,
  "severity_overridden": 0,
  "final_exit_code": 0,
  "trace_summary": { "claims": 7, "orphan_sites": 0 },
  "drift_summary": { "stale": 1, "abandoned": 0, "missing": 0 },
  "exempt_summary": { "active": 0, "expired_present": 0 },
  "commands_run": [
    { "argv": ["cargo", "test", "--workspace"], "exit_code": 0 }
  ]
}
